UPDATE STUDENT     SET REGISTER_NO = 191911023    WHERE REGISTER_NO = 191711342;

mysql> use student1
Database changed
mysql>  select* from student;
+-------------+---------+--------+------------+-----------+------------+
| REGISTER_NO | NAME    | GENDER | DOB        | MOBILE_NO | CITY       |
+-------------+---------+--------+------------+-----------+------------+
|   191711342 | viki    | M      | 1998-01-22 |     79764 | CHENNAI    |
|   192011002 | vikas   | M      | 2002-02-23 |     79845 | CHENNAI    |
|   192011003 | sekar   | M      | 2003-06-15 |     68768 | CHENNAI    |
|   192011004 | vishnu  | M      | 2002-08-23 |     97894 | SAILAYUR   |
|   192011008 | aishu   | F      | 2002-02-15 |     78487 | MOTIHARI   |
|   192011010 | prakesh | M      | 2000-01-23 |     79322 | JUMBOBUMBO |
+-------------+---------+--------+------------+-----------+------------+
6 rows in set (0.04 sec)


#3.DELETE THE RECORD

mysql> DELETE FROM FAl      WHERE DOJ = "2022-02-14";
Query OK, 1 row affected (0.00 sec)

mysql> select* from fal;
+------------+----------+--------+------------+------------+-----------+------+------+
| Faculty_id | Fac_Name | gender | DOB        | DOJ        | Mobile_no | dept | age  |
+------------+----------+--------+------------+------------+-----------+------+------+
| 1221       | ESWAR    | M      | 2000-01-15 | 2012-01-13 |   7823228 | IT   |   24 |
| 1451       | VENTHNA  | F      | 2004-06-27 | 2021-05-11 |    723458 | ECE  |   57 |
| 2321       | RAM      | M      | 2022-03-17 | 2004-05-16 |     83235 | EEE  |   34 |
+------------+----------+--------+------------+------------+-----------+------+------+
3 rows in set (0.00 sec)


#4 MODIFY 


mysql> UPDATE FAL      SET DOB = "1983-05-01"      WHERE FAC_NAME = 'RAM';
Query OK, 1 row affected (0.00 sec)
Rows matched: 1  Changed: 1  Warnings: 0

mysql> select* from fal;
+------------+----------+--------+------------+------------+-----------+------+------+
| Faculty_id | Fac_Name | gender | DOB        | DOJ        | Mobile_no | dept | age  |
+------------+----------+--------+------------+------------+-----------+------+------+
| 1221       | ESWAR    | M      | 2000-01-15 | 2012-01-13 |   7823228 | IT   |   24 |
| 1451       | VENTHNA  | F      | 2004-06-27 | 2021-05-11 |    723458 | ECE  |   57 |
| 2321       | RAM      | M      | 1983-05-01 | 2004-05-16 |     83235 | EEE  |   34 |
+------------+----------+--------+------------+------------+-----------+------+------+
3 rows in set (0.00 sec)

# REMOVE 
mysql>   DELETE FROM FAL  WHERE AGE > 65;
Query OK, 0 rows affected (0.00 sec)

mysql> select* from fal;
+------------+----------+--------+------------+------------+-----------+------+------+
| Faculty_id | Fac_Name | gender | DOB        | DOJ        | Mobile_no | dept | age  |
+------------+----------+--------+------------+------------+-----------+------+------+
| 1221       | ESWAR    | M      | 2000-01-15 | 2012-01-13 |   7823228 | IT   |   24 |
| 1451       | VENTHNA  | F      | 2004-06-27 | 2021-05-11 |    723458 | ECE  |   57 |
| 2321       | RAM      | M      | 1983-05-01 | 2004-05-16 |     83235 | EEE  |   34 |
+------------+----------+--------+------------+------------+-----------+------+------+
3 rows in set (0.00 sec)
